text,url,title,id_news,category
"Un reportaje de Mega Investiga evidenció la lujosa vida que llevaba el narcotraficante chileno Cristian Aguirre, quien se hizo conocido por llegar en helicóptero a una costosa clínica del sector oriente de Santiago en 2021 y que recientemente fue condenado a 50 años de cárcel. El líder del cartel Jalisco Nueva Generación de Melipilla, buscaba emular a los carteles mexicanos reconocidos por tráfico de droga a través de viajes al caribe, joyas de alto valor y vehículos de alta gama. El periodista de Meganoticias, Juan Carlos Araya, entregó detalles sobre la lujosa vida de Aguirre y explicó que es ""el narcotraficante más excéntrico que se ha puesto tras las rejas en el último tiempo en el país"".  ""No tenía ningún empacho en exhibirse a través de las redes sociales, mostrando cadenas de oro de más de cinco millones de pesos, viajes a México, un patrimonio de cerca de 3 mil millones, fruto del lavado de dinero que fue generando a través de la venta ilícita de cocaína que traía de Bolivia"", mencionó. Fue precisamente la exhibición de sus viajes y lujos lo que hizo levantar las primeras sospechas. ""La gente en Melipilla lo comenzó a ver en autos costosos, en Audi de $30 millones, descapotable. Comenzó a apoderarse de 7 poblaciones de la periferia, a punta de fusiles y armas de guerra"", sostuvo Araya. Paul Martinson, Fiscal Jefe de Curacaví, explicó cómo funcionaba la estructura criminal que lideraba Cristian Aguirre y sostuvo que adoptaba la forma de ""una empresa que uno podría decir que tenía supuestos departamentos: uno dedicado a la venta de droga y otro al acopio de dinero y al lavado de activos"". Aguirre llegó a fines de 2021 en helicóptero a una clínica del sector oriente de la capital tras recibir impactos de bala luego de enfrentarse a una banda rival. Tras la intervención, su Isapre no cubrió los procedimientos y ahora se enfrenta a una demanda por una deuda de $270 millones de pesos. El pasado 12 de agosto, Cristian Aguirre fue condenado a 50 años de cárcel y no se ha presentado ningún recurso de apelación en torno a la condena, según confirmó el periodista de Meganoticias. Todo sobre Noticias Chile",https://www.meganoticias.cl/nacional/456727-crisitan-aguirre-helicoptero-clinica-cartel-jalisco-nueva-generacion-melipilla-brk-23-08-2024.html,Llegó a la clínica en helicóptero: Así era la lujosa vida de líder narco chileno condenado a 50 años de cárcel,53.556.199,entretenimiento
"Como descendientes directos de bacterias antiguas, las mitocondrias siempre han sido un poco extrañas. Ahora un estudio demuestra que las mitocondrias son posiblemente incluso más extrañas de lo que pensábamos. El estudio descubrió que las mitocondrias de nuestras células cerebrales frecuentemente lanzan su ADN al núcleo, donde el ADN se integra en los cromosomas de las células. Y estas inserciones pueden estar causando daños: entre los casi 1.200 participantes del estudio, aquellos con más inserciones de ADN mitocondrial en sus células cerebrales tenían más probabilidades de morir antes que aquellos con menos inserciones. “Solíamos pensar que la transferencia de ADN de las mitocondrias al genoma humano era un fenómeno poco frecuente”, afirmó en un comunicado el psicobiólogo mitocondrial y profesor asociado de medicina conductual de la U. de Columbia, Martin Picard, quien dirigió el estudio junto a Ryan Mills de la U. de Michigan. “Es sorprendente que esto parezca ocurrir varias veces durante la vida de una persona”, añadió Picard. “Hemos encontrado muchas de estas inserciones en distintas regiones cerebrales, pero no en las células sanguíneas, lo que explica por qué decenas de estudios anteriores que analizaban el ADN de la sangre no detectaron este fenómeno”. Las mitocondrias viven en el interior de todas nuestras células, pero a diferencia de otros orgánulos, tienen su propio ADN, una pequeña cadena circular con alrededor de tres docenas de genes. El ADN mitocondrial es un remanente de los antepasados de los orgánulos: bacterias antiguas que se asentaron en el interior de nuestros ancestros unicelulares hace unos 1.500 millones de años. En las últimas décadas, los investigadores descubrieron que, ocasionalmente, el ADN mitocondrial “saltaba” del orgánulo hacia los cromosomas humanos. “El ADN mitocondrial se comporta de manera similar a un virus en el sentido de que hace uso de cortes en el genoma y se pega a sí mismo, o como genes saltarines conocidos como retrotransposones que se mueven alrededor del genoma humano”, dice Mills. Las inserciones se denominan segmentos nuclear-mitocondriales (NUMT, por sus siglas en inglés) y se han ido acumulando en nuestros cromosomas durante millones de años. “Como resultado, todos caminamos con cientos de segmentos de ADN mitocondrial vestigiales, en su mayoría benignos, en nuestros cromosomas que heredamos de nuestros antepasados”, dice Mills. Las investigaciones realizadas en los últimos años han demostrado que la “NUMTogénesis” todavía ocurre hoy en día. “El salto del ADN mitocondrial no es algo que sólo haya ocurrido en el pasado lejano”, afirmó Kalpita Karan, investigadora posdoctoral en el laboratorio de Picard que dirigió la investigación junto con Weichen Zhou, investigadora del laboratorio de Mills. “Es poco frecuente, pero un nuevo NUMT se integra en el genoma humano aproximadamente una vez cada 4.000 nacimientos. Esta es una de las muchas formas, conservadas desde la levadura hasta los humanos, mediante las cuales las mitocondrias se comunican con los genes nucleares”. La constatación de que todavía se están creando nuevos NUMT heredados hizo que Picard y Mills se preguntaran si los NUMT también podrían surgir en las células cerebrales a lo largo de nuestra vida. “Las NUMT hereditarias son en su mayoría benignas, probablemente porque surgen en las primeras etapas del desarrollo y las dañinas se eliminan”, afirma Zhou. Pero si un fragmento de ADN mitocondrial se inserta en un gen o una región reguladora, podría tener consecuencias importantes para la salud o la esperanza de vida de esa persona. Las neuronas pueden ser especialmente susceptibles a los daños causados por las NUMT porque cuando una neurona se daña, el cerebro no suele crear una nueva célula cerebral para ocupar su lugar. Para examinar el alcance y el impacto de los nuevos NUMT en el cerebro, el equipo trabajó con Hans Klein, profesor adjunto del Centro de Neuroinmunología Traslacional y Computacional de Columbia, que tuvo acceso a secuencias de ADN de los participantes en el estudio sobre el envejecimiento ROSMAP (dirigido por David Bennett en la Universidad Rush). Los investigadores buscaron NUMT en diferentes regiones del cerebro utilizando muestras de tejido almacenadas de más de 1.000 adultos mayores. Su análisis mostró que la inserción del ADN mitocondrial nuclear ocurre en el cerebro humano, principalmente en la corteza prefrontal, y probablemente varias veces durante la vida de una persona. También descubrieron que las personas con más NUMT en la corteza prefrontal morían antes que las personas con menos NUMT. “Esto sugiere por primera vez que los NUMT pueden tener consecuencias funcionales y posiblemente influir en la esperanza de vida”, afirma Picard. “La acumulación de NUMT puede añadirse a la lista de mecanismos de inestabilidad del genoma que pueden contribuir al envejecimiento, al deterioro funcional y a la esperanza de vida”. ¿Qué causa los NUMT en el cerebro y por qué algunas regiones se acumulan más que otras? Para obtener algunas pistas, los investigadores analizaron una población de células de piel humana que pueden cultivarse y envejecerse en un plato durante varios meses, lo que permite realizar estudios longitudinales excepcionales de “duración de vida”. Estas células cultivadas acumularon gradualmente varios NUMT por mes, y cuando las mitocondrias de las células dejaron de funcionar debido al estrés, las células acumularon NUMT cuatro a cinco veces más rápido. “Esto muestra una nueva forma en la que el estrés puede afectar la biología de nuestras células”, afirmó Karan. “El estrés aumenta la probabilidad de que las mitocondrias liberen fragmentos de su ADN y estos fragmentos pueden entonces ‘infectar’ el genoma nuclear”, añadió Zhou. Es sólo una de las formas en las que las mitocondrias moldean nuestra salud más allá de la producción de energía. “Las mitocondrias son procesadores celulares y una poderosa plataforma de señalización(el enlace es externo y se abre en una nueva ventana)”Sabíamos que pueden controlar qué genes se activan o desactivan. Ahora sabemos que las mitocondrias pueden incluso cambiar la propia secuencia de ADN nuclear”. Los comentarios en esta sección son exclusivos para suscriptores. Suscríbete aquí.",https://www.latercera.com/que-pasa/noticia/ocurre-cada-4000-nacimiento-cientificos-descubren-extrana-forma-en-que-nuestros-cerebros-estan-mutando/XI2SYPKD3FGOBGUOAOHQF7WTEI/,Ocurre cada 4.000 nacimiento: científicos descubren extraña forma en que nuestros cerebros están mutando,53.563.001,salud
"El diputado Miguel Ángel Becker (RN) reveló que ""Sí. Hubo participación de agentes externos, de agentes del gobierno del dictador Maduro de Venezuela"" en el asesinato del ex teniente Ronald Ojeda, según el informe de la Comisión Investigadora por Crimen Organizado. Con cinco votos a favor y dos en contra, se concluyó que la cooperación policial entre Chile y Venezuela ha sido insuficiente, criticando al Subsecretario del Interior por sus alianzas regionales. Se señaló la falta de protección a refugiados y la impunidad del crimen, apuntando a posibles infiltraciones de redes criminales venezolanas en Chile. El informe fue rechazado por Félix González (FRSV) y Matías Ramírez (PC), generando críticas por querer negar la existencia de crimen organizado en el país. “Sí. Hubo participación de agentes externos, de agentes del gobierno del dictador Maduro de Venezuela”. Con estas palabras el diputado Miguel Ángel Becker (RN) presentó el informe de la Comisión Investigadora por Crimen Organizado, la que tuvo como eje central el asesinato del ex teniente Ronald Ojeda. Con cinco votos a favor y dos en contra, el documento de 20 caras vinculó la situación política entre países con el crimen. Concluyendo que la firma del Acuerdo de Cooperación Internacional policial entre Chile y Venezuela ha sido insuficiente. “La inocencia del Subsecretario del Interior al suscribir un acuerdo de cooperación policial con un autoritarismo reconocido, deja en evidencia la confusión del Gobierno al abordar el combate al crimen organizado, y nos obliga a cuestionarnos nuestras alianzas regionales“, reza el escrito. Además, se señala que nuestro país fracasó en brindar protección a las personas refugiadas, por lo cual, “se requiere que el Ministerio de RREE y el de Justicia informen a la Oficina del Alto Comisionado de las Naciones Unidas para los Refugiados y al Comité de Derechos Humanos sobre estas deficiencias”. Otro punto que toca el informe es la “falta de control de las fronteras y su violación constante por parte de bandas de crimen organizado”. Al respecto, asegura que hay “impunidad del crimen y un daño a la vida, seguridad y libertad de todos los habitantes de la República de Chile”. Finalmente, la principal conclusión es que probablemente hubo una influencia del gobierno venezolano en el crimen, esto por “posibles infiltraciones de redes criminales en Chile, compuestas por exmilitares y agentes de inteligencia venezolanos, lo cual representa una amenaza para la seguridad nacional”. {{ post.resumen_de_ia }}",https://www.biobiochile.cl/noticias/nacional/chile/2024/08/05/comision-investigadora-concluye-que-crimen-de-ojeda-podria-estar-vinculado-al-regimen-venezolano.shtml,"Comisión Investigadora concluye que crimen de Ojeda ""podría estar vinculado al régimen venezolano""",53.523.007,internacional
"Sujeto que salía de un domicilio les apuntó con un arma y tras dar aviso a Carabineros, tanto él como una mujer resultaron detenidos PUCHUNCAVÍ.- Un hombre y una mujer resultaron detenidos tras la alerta de un robo en proceso en una vivienda del sector de Ventanas, en la comuna de Puchuncaví. Según la información proporcionada por la institución, a eso de las 17:40 horas de este domingo, vecinos del sector fueron testigos de la salida de un desconocido desde una vivienda, en el sector de Lomas 3, en Ventana Alto. Como no se trataba del dueño de la vivienda, los vecinos lo acorralaron, pero en esos momentos el sujeto sacó un arma tipo pistola  y les apuntó, para luego huir del lugar. Los vecinos dieron aviso a Carabineros, entregando la descripción física del maleante, tras lo cual una patrulla del retén Ventanas salió rápidamente al lugar, sorprendiéndolo mientras huía por el patio de otro domicilio del sector. Mientras el sujeto era detenido, al lugar llegó al lugar una mujer quien de forma ofuscada se oponía a la detención, quien tras ser fiscalizada, se le incautó un arma blanca; siendo también detenida por el personal policial. Ambas personas quedaron a disposición del Ministerio Público, pasando a control de detención; mientras que el total de elementos incautados correspondió a 1 pistola de fogueo no apta para el disparo, sin cargador, un arma blanca, tipo cuchillo cocinero y una herramienta utilizada para ingreso al domicilio.",https://www.observador.cl/vecinos-frustran-robo-en-vivienda-de-puchuncavi/,Vecinos frustran robo en vivienda de Puchuncaví,53.555.419,accidentes
"Una mujer de 70 años falleció atropellada en la ruta que une Valdivia con San José de la Mariquina, región de Los Ríos, específicamente en Linguento. Carabineros informó que una camioneta chocó con la adulta mayor mientras cruzaba la calzada, provocando su muerte instantánea. La sección de Investigación de Accidentes de Tránsito se movilizó al lugar para indagar las circunstancias del accidente. La ruta permanece abierta en ambos sentidos y el conductor se encuentra detenido a la espera de las instrucciones del Ministerio Público. Una mujer de 70 años murió atropellada en la ruta que conecta Valdivia con San José de la Mariquina, región de los Ríos. Precisamente a la altura de Linguento, y de acuerdo a los antecedentes entregados por Carabineros, una camioneta atropelló a la adulta mayor mientras cruzaba la calzada, falleciendo en el acto. Se trasladó hasta el sector personal de la sección de Investigación de Accidentes de Tránsito, para esclarecer las causas que originaron el siniestro. La ruta se encuentra habilitada en ambos sentidos y el conductor quedó detenido a la espera de las instrucciones del Ministerio Público. {{ post.resumen_de_ia }}",https://www.biobiochile.cl/noticias/nacional/region-de-los-rios/2024/08/15/mujer-de-70-anos-fallece-tras-ser-atropellada-por-una-camioneta-en-valdivia.shtml,Mujer de 70 años fallece tras ser atropellada por una camioneta en Valdivia,53.877.874,accidentes
"Durante la tarde de este miércoles se registró un sismo de magnitud 2,8 en la región de Antofagasta, cuando el reloj marcaba las 17:33 horas. El movimiento telúrico, según la información proporcionada por el Centro Sismológico Nacional de la Universidad de Chile, tuvo su epicentro a 44 kilómetros al oeste de Paposo, a 34 kilómetros de profundidad. Por ahora, Senapred no ha reportado daños a personas, infraestructuras ni servicios básicos a raíz del temblor.  Si quieres ser alertado en tu celular de la ocurrencia de un terremoto, Google envía a una alerta para los dispositivos que tengan Android 12 u otras versiones posteriores. Para más detalles ingresa a este link. Como los temblores o terremotos siempre llegan sin aviso, es vital poder tener un plan de evacuación diseñado que cuente con un kit de emergencia, el cual detallamos haciendo clic acá. Para más recomendaciones sobre qué hacer en caso de un fuerte temblor o terremoto, puedes ingresar directamente al sitio web de Senapred. Todo sobre Temblor",https://www.meganoticias.cl/nacional/457220-temblor-paposo-antofagasta-taltal-hoy-miercoles-sismologia-brk-28-08-2024.html,Temblor se percibe en la zona norte del país: Esta fue la magnitud del sismo,53.583.464,accidentes
"La derecha en Concepción, región del Bío Bío, enfrenta dificultades para definir un candidato único en las elecciones municipales, ya que no hay tiempo para realizar encuestas y solo un acuerdo político entre Chile Vamos y Republicanos podría resolver la situación. La candidata de Chile Vamos, Valentina Pavez Van Rysselberghe, reconoce la improbabilidad de realizar una encuesta y menciona la posibilidad de bajas de candidaturas. Por su parte, el candidato republicano James Argo responde subiendo el tono del debate y emplazando a transparentar las encuestas. En medio de esta disputa, el candidato Social Cristiano, Héctor Muñoz, destaca que las encuestas le favorecen y llama a Argo a sincerar las cifras. Si no se logra un acuerdo, las elecciones podrían resultar en un triunfo con bajo porcentaje y escasa diferencia entre los rivales. Es muy probable que la derecha no pueda realizar una encuesta para definir un candidato único para la elección municipal en Concepción, en la región del Bío Bío. Solamente un acuerdo político podría limar asperezas entre Chile Vamos y Republicanos; sin embargo, esta posibilidad también se ve lejana. Desde el Partido Social Cristiano emplazaron al candidato republicano, James Argo, a transparentar las encuestas, quien respondió y subió el tono del debate. Ya no hay tiempo para encuestas y sólo un acuerdo político podría ser la salida para la derecha en Concepción y así lograr llevar sólo a un candidato de los tres que se mantienen en carrera por el municipio penquista. De todas maneras, desde Chile Vamos, la candidata de este sector, Valentina Pavez Van Rysselberghe, reconoció que es muy poco probable hacer una encuesta. Todo pasa por bajas de candidaturas. Si Republicanos cede en Gobernadores Regionales, la UDI estaría dispuesta a bajar su carta, lo que se ve lejos de acuerdo. La hija de la exsenadora Jacqueline Van Rysselberghe aseguró que lleva días intentando conversar con James Argo, pero “ni siquiera me contesta el teléfono”. El diputado de la UDI, Sergio Bobadilla, ha participado activamente en la campaña del candidato que va por el partido Republicano, James Argo. Él apela a la generosidad, reconociendo que si Fernando Peña declina su candidatura a gobernador del Bío Bío, es posible que también lo haga Valentina Pavez. También es actor en esta historia el candidato del Partido Social Cristiano y exconcejal por Concepción, Héctor Muñoz, quien asegura que las encuestas le favorecen, por lo mismo llamó a James Argo a sincerar las cifras. Frente a estas declaraciones, James Argo subió el tono de las declaraciones y cuestionó la visita de Evelyn Matthei el fin de semana para apoyar a candidatos de Chile Vamos y llamó a al candidato Social Cristiano, Héctor Muñoz, a seguir el ejemplo de Cristo. Por el momento, las candidaturas siguen tal cual en Concepción, cuatro del oficialismo ligados a la izquierda y centro izquierda; y tres de oposición ligados a la derecha y centro derecha. De ser este el escenario para las elecciones de octubre, es posible que quien triunfe en el municipio penquista lo haga con poco porcentaje y con escasa diferencia de sus rivales. {{ post.resumen_de_ia }}",https://www.biobiochile.cl/noticias/nacional/region-del-bio-bio/2024/08/12/la-derecha-sigue-dividida-en-concepcion-pavez-dice-que-argo-ni-siquiera-me-contesta-el-telefono.shtml,"La derecha sigue dividida en Concepción: Pavez dice que Argo ""ni siquiera me contesta el teléfono""",53.522.108,politica
"Facundo Jones Huala, lonco argentino, fue detenido tras amenazar a un médico en el Hospital Intercultural de Nueva Imperial. La detención fue autorizada por el fiscal de turno y Jones Huala fue trasladado a la Cuarta Comisaría de Nueva Imperial. Recientemente, el Gobierno emitió una orden de expulsión, luego de que recuperara su libertad por fallo de la Corte Suprema. El lonco argentino, Facundo Jones Huala, fue detenido este miércoles tras amenazar a un médico que lo atendía en el Hospital Intercultural de Nueva Imperial. De acuerdo a información de Radio Bío Bío, Jones Huala -quien estaba próximo a ser dado de alta- amenazó a un facultativo de nacionalidad extranjera. En ese sentido, la detención en cuestión fue autorizada por el fiscal de turno. Ante lo ocurrido, se determinó el traslado del lonco trasandino hasta el cuartel de la Cuarta Comisaría de Nueva Imperial. Hace unos días, el Gobierno -a través del Ministerio del Interior– emitió una orden de expulsión de Jones Huala. Lo anterior, luego que este último recuperara su libertad tras un fallo de la Corte Suprema. Facundo Jones Huala fue notificado la jornada del pasado viernes por la Policía de Investigaciones al interior del Hospital Intercultural de Nueva Imperial, mismo recinto en que fue detenido por las amenazas ya mencionadas. El lonco permaneció internado en ese lugar en estado grave tras una huelga de hambre que se extendió por más de 50 días, en que -incluso- perdió más de 20 kilos de su masa corporal. En específico, el líder de la orgánica trasandina Resistencia Ancestral Mapuche estuvo cumpliendo condena por un ataque incendiario en el fundo Pisu Pisué de Río Bueno, región de Los Ríos. {{ post.resumen_de_ia }}",https://www.biobiochile.cl/noticias/nacional/region-de-la-araucania/2024/08/21/facundo-jones-huala-es-detenido-por-amenazar-a-medico-que-lo-atendia-en-hospital-de-nueva-imperial.shtml,Facundo Jones Huala es detenido por amenazar a médico que lo atendía en Hospital de Nueva Imperial,53.877.730,politica
