text,url,title,id_news,category
"La Dirección Meteorológica de Chile (DMC) anunció la llegada un sistema frontal con viento y lluvia que afectará a once regiones del país durante los primeros días de septiembre. Según informó la entidad, está pronosticado que caiga 140 milímetros y vientos de 100 kilómetros por hora. “Primero tenemos el núcleo frío en altura, o bajas segregadas, que es lo que hemos tenido esta última semana de agosto y el segundo es un sistema frontal que va afectar a la zona sur y centro sur de nuestro país durante los próximos días y los primeros días del mes de septiembre”, explicó la meteoróloga de Canal 13, Michelle Adam. Un informe de Meteored aseguró que agosto terminará con lluvias en el Norte Chico y la Región Metropolitana. Junto a ello, se espera que unas precipitaciones débiles abarquen entre la Región de Atacama y O’Higgins para este viernes 30 de agosto. “Sin embargo, a contar del sábado 31 de agosto, las condiciones meteorológicas cambiarán rotundamente en el gran Santiago. Con el cielo sin una nube, los termómetros matutinos se moverán entre 1 °C y 3 °C, por lo que será necesario salir de casa con un outfit invernal y con varias capas para evitar resfríos por cambios bruscos de temperatura”, señalaron desde la DMC. Meteored indicó que debido a una baja segregada, se registrarán chubascos débiles en la Región de Coquimbo, donde según el modelo ECMWF, las lluvias dejarán 15,7 milímetros en Salamanca y 17,1 en Petorca durante esta jornada de viernes. Desde el 1 de septiembre se producirá un río atmosférico en el sector de la Patagonia con lluvias y ráfagas de viento que podrían alcanzar los 100 kilómetros por hora en las regiones de Aysén y Magallanes. Asimismo, las precipitaciones se mantendrán en las regiones de Los Ríos, Los Lagos, La Araucanía y el Bío Bío. “Estas zonas tendrán lluvias a ratos intensas, sobre todo en sectores costeros y también se prevén nevadas en la cordillera de todo el tramo”, añadieron. Posterior a ello, la noche del lunes 1 de septiembre el sistema frontal dejará lluvias en las regiones de Ñuble, el Maule y O’ Higgins.",https://www.eldinamo.cl/pais/2024/08/30/dos-fenomenos-afectaran-a-once-regiones-lluvia-de-mas-de-100-mm-y-viento-sobre-los-100-kms-hr/,Dos fenómenos afectarán a once regiones: lluvia de más de 100 mm y viento sobre los 100 kms/hr,53.580.886,accidentes
"Actualmente  la tecnología es un factor clave en el sector de la automoción  y a medida que pasa el tiempo los vehículos vienen dotados con más sistemas que mejoran la seguridad y comodidad a la hora de conducir. Un ejemplo de ellos son los llamados  sistemas avanzados de asistencia a la conducción (ADAS por sus siglas en inglés) , que no son otra cosa que tecnologías que persiguen  reducir la siniestralidad en las carreteras , gracias a su capacidad para detectar situaciones de riesgo, alertar al conductor y, en casos extremos, llegar a actuar automáticamente; además de incrementar el confort en los trayectos diarios. Estos sistemas se han ido incorporando de forma progresiva en la oferta automotriz a partir de 2012  cuando se empezaron a introducir en vehículos de alta gama y posteriormente, desde 2015-2016, se amplió a los de gama media, para continuar expandiéndose en los mercados. Los ADAS son el primer gran paso hacia la conducción autónoma , aunque esto no significa bajo ningún concepto que reemplacen al conductor ni lo eximan de su responsabilidad al volante. La variedad de estos sistemas es muy amplia y cada vez lo será más a medida que los fabricantes vayan investigando y desarrollando nuevos equipamientos. A continuación, detallamos los más conocidos.   Diseño:  Daniel Suárez E. |  Contenido:  Carlos Valdés O. |  Fuente:  Emol   Recursos:  Freepik  ",https://www.emol.com/noticias/Autos/2024/08/02/1138566/infografia-asistencias-a-ka-conduccion.html,Infografía: Conoce cuáles son las asistencias a la conducción más usadas,53.571.063,tecnologia
"Una banda de falsos policías quedó en prisión preventiva en la región de Coquimbo, tras ser acusada de robos con homicidio, violencia, intimidación, secuestro, mutilaciones, violación y abusos sexuales. Más de 160 detectives participaron en la Operación Pantan, desarticulando un grupo de 25 miembros que se hacían pasar por policías armados en sectores rurales para cometer delitos violentos. La banda, mayormente de Viña del Mar, Valparaíso, Quilpué y Quillota, actuaba contra personas dedicadas al cultivo de cannabis procesada. Se destacó el trabajo conjunto de la PDI y la Fiscalía para desmantelar la estructura criminal, con órdenes de detención para 7 prófugos aún en curso. En prisión preventiva quedó una banda de falsos policías por una serie de delitos como robos con homicidio, violencia e intimidación, secuestro, mutilaciones, violación y abusos sexuales, en la región de Coquimbo. Fueron más de 160 detectives que participaron en la “Operación Pantan”, un masivo despliegue para desarticular una banda conformada por 25 miembros, la mayoría con residencia en Viña del Mar, Valparaíso, Quilpué y Quillota. Durante más de dos años, los imputados viajaban con armas de grueso calibre a la región de Coquimbo. Elegían a sus víctimas, en sectores rurales y alejados dentro de las tres provincias, y se hacían pasar por policías para cometer una serie de delitos violentos. Según detalló el prefecto inspector Ernesto León, jefe de la Región Policial de Coquimbo, se trató de delitos como robo con homicidio, violencia e intimidación, secuestro, mutilaciones, torturas, violación, abusos sexuales y amenazas entre el año 2022 y 2023. “Con todas las evidencias, dimos cumplimiento a la orden de entrada y registro para 15 domicilios, donde logramos detener otros 6 imputados”, detalló León. En cuanto a los integrantes, se trata de una banda conformada por chilenos y mayores de edad. Los sujetos actuaba contra personas que se dedicaban al cultivo y resguardo de cannabis procesada. “Es un grupo organizado violento, que llama la atención porque se traslada a la región de Coquimbo. Seguramente pensaban que aquí no los iban a identificar como autores de estos delitos”, dijo el fiscal Patricio Cooper. A la vez, el persecutor de la región de Coquimbo destacó “el buen trabajo realizado por la PDI y la Fiscalía de Focos Investigativos” que permitió “desarticular esta estructura criminal”. En tanto, el delegado presidencial regional, Galo Luna, comentó que “hoy damos un golpe fuerte al crimen organizado, a las bandas criminales. Estamos retirando armas con un alto poder de fuego, que es parte de nuestra Política Nacional contra el crimen organizado”. Finalmente, las diligencias de la Operación “Pantan” siguen en desarrollo. De hecho, aún se siguen los pasos a otros 7 prófugos de esta banda criminal que están identificados y con órdenes de detención en su contra. {{ post.resumen_de_ia }}",https://www.biobiochile.cl/noticias/nacional/region-de-coquimbo/2024/08/06/cae-banda-de-falsos-policias-en-coquimbo-realizaban-presuntos-allanamientos-para-cometer-delitos.shtml,Cae banda de falsos policías en Coquimbo: realizaban presuntos allanamientos para cometer delitos,53.876.939,entretenimiento
"El presidente  Gabriel Boric  informó a través de X que se reunió este sábado con el ministro de Relaciones Exteriores,  Alberto van Klaveren , y el embajador de Chile en Venezuela,  Jaime Gazmuri  (quien llegó hoy a territorio nacional tras ser expulsado de dicho país), y reiteró que no validarán resultados que no estén verificados.   ""Recibí en La Moneda al canciller y al embajador de Chile en Venezuela quien arribó hoy a nuestro país junto al personal diplomático,  luego de la intempestiva e injustificada expulsión. Mantenemos nuestra posición "", expresó en primer lugar.  RelacionadasDetalle('1138649','1138643'); Luego, sentenció que "" no reconocemos el proclamado triunfo de Maduro  y no validaremos ningún resultado que no esté verificado por organismos internacionales independientes"". Además, y considerando que durante esta jornada se desarrollan protestas en Venezuela en contra de Maduro, pidió que se respeten los derechos humanos.  ""Hacemos un llamado a respetar íntegramente los derechos humanos de los manifestantes en Venezuela  y terminar con las detenciones arbitrarias y la violencia "", acotó.",https://www.emol.com/noticias/Nacional/2024/08/03/1138653/boric-canciller-gazmuri-elecciones-venezuela.html,Boric se reúne con canciller y embajador Gazmuri y reitera que no validarán resultados en Venezuela que no estén verificados,53.418.593,internacional
"Durante la madrugada de este lunes 26 de agosto se registró un sismo de magnitud 4,7 en la región de Coquimbo, cuando el reloj marcaba las 02:21 horas. El movimiento telúrico, según la información proporcionada por el Centro Sismológico Nacional de la Universidad de Chile, tuvo su epicentro a 12 kilómetros al sur de Pichidangui, a 70 kilómetros de profundidad. Por ahora, Senapred no ha reportado daños a personas, infraestructuras ni servicios básicos a raíz del temblor.  Hora Local: 2024/08/26 02:21:08, mag: 4.7, Lat: -32.24, Lon: -71.55, Prof: 70.5, Loc : 12.17 km al S de Pichidangui  Si quieres ser alertado en tu celular de la ocurrencia de un terremoto, Google envía a una alerta para los dispositivos que tengan Android 12 u otras versiones posteriores. Para más detalles ingresa a este link. Como los temblores o terremotos siempre llegan sin aviso, es vital poder tener un plan de evacuación diseñado que cuente con un kit de emergencia, el cual detallamos haciendo clic acá. Para más recomendaciones sobre qué hacer en caso de un fuerte temblor o terremoto, puedes ingresar directamente al sitio web de Senapred. Recomendaciones de Senapred: Debes prepararte para ser autosuficiente por 72 horas teniendo: Todo sobre Temblor",https://www.meganoticias.cl/nacional/456900-temblor-epicentro-hoy-zona-central-region-coquimbo-region-metropolitana-pichidangui-magnitud-sismo-brk-26-08-2024.html,Sismo se percibe en la zona central: Revisa la magnitud y dónde se sintió el temblor,53.588.351,accidentes
"El ministro de Energía, Diego Pardow, detalló este lunes el mecanismo de compensación para los clientes afectados por los masivos cortes de luz en Chile tras el sistema frontal registrado a comienzos de agosto. La medida contempla, en primer lugar, compensaciones automáticas, es decir, no será necesario que los consumidores presenten un reclamo, ya que las empresas saben quiénes estuvieron sin suministro. Asimismo, habrá una indemnización complementaria a través del Sernac, con el que se buscará reparar diversos perjuicios que se generaron a raíz de la falta de electricidad. Pardow explicó que se ha instruido a las empresas de distribución ""enviar los datos de facturación por quincena de este mes para que se pueda reflejar un descuento en la próxima boleta que vean las personas"".    ""Es una compensación que no inhibe y no obstaculiza la reparación integral de las personas, por los alimentos y remedios que perdieron por falta de refrigeración y por el daño moral que han sufrido durante estos días"", señaló el secretario de Estado. Esta indemnización tampoco inhibe a las empresas de hacerse cargo de ""aquellos electrodomésticos y artefactos que vieron afectación debido a los cambios en el voltaje"".  Por su parte, los daños adicionales, como la pérdida de alimentos congelados y afectaciones a electrodomésticos, serán abordados por el Servicio Nacional del Consumidor (Sernac). Su director, Andrés Herrera, indicó que la entidad ""ha emplazado a distintas empresas eléctricas para someterse a los denominados Procedimientos Voluntarios Colectivos"". Según Herrera, este es el mecanismo ""más rápido que establece nuestra normativa de protección al consumidor para entregar una solución integral, proporcional y universal a todos los consumidores que se han visto afectados"". Sin embargo, advirtió que si las empresas no cumplen con estos procedimientos, se procederá con demandas colectivas, que podrían implicar multas de hasta 38 millones de dólares. Todo sobre Sernac",https://www.meganoticias.cl/nacional/455651-afectados-cortes-de-luz-compensaciones-automaticas-complementarias-brk-12-08-2024.html,Compensaciones automáticas y complementarias: Así serán las indemnizaciones para afectados por cortes de luz,53.413.468,politica
"Un adolescente de 16 años fue detenido en Lota al ser sorprendido incumpliendo un arresto domiciliario total por homicidio, quedando con la misma medida cautelar en Angol. Durante un control vehicular, carabineros interceptó una motocicleta que intentó huir, culminando en la detención del menor en Cancha Calama. Portaba un chaleco antibalas y tiene antecedentes por receptación, robo con violencia, microtráfico de drogas y un homicidio en el que está implicado. A pesar de su historial delictivo, deberá cumplir su arresto domiciliario en Angol después de incumplirlo en Lota. Un adolescente de 16 años fue detenido en Lota al ser sorprendido incumpliendo un arresto domiciliario total por el delito de homicidio. Sin embargo, el imputado quedó con la misma medida cautelar, la que deberá continuar en Angol. Carabineros realizaba controles vehiculares en rutas y sectores urbanos de la comuna de Lota durante la tarde de este viernes, y fue en ese contexto que una motocicleta, con dos ocupantes en su interior, se dio a la fuga. Ya en el sector de Cancha Calama, su conductor perdió el control tras querer evadir el trabajo policial. Por lo anterior, el motorista arrancó, mientras que su acompañante, un menor de 16 años, logró ser detenido. El imputado fue sorprendido portando un chaleco antibalas e incumplía la medida cautelar de arresto domiciliario total en una causa por homicidio. Así lo dijo el capitán de la Tercera Comisaría de Lota, Bruno Gallardo. El sujeto posee detenciones por otros delitos como receptación y robo con violencia, además de una causa vigente por microtráfico de drogas del año 2022 en la que está como imputado junto a otro adolescente. También por ser el responsable de un homicidio. Este último, en junio de 2024 fue brutalmente asesinado en la vía pública Axel Concha Morales, de 17 años, acribillado a balazos en la población Doña Graciela de Coronel. Respecto a B.I.H.V de 16 años, pese a incumplir la medida de privación de libertad en su casa, quedó con la misma cautelar, la que deberá seguir cumpliendo en Angol, región de la Araucanía. {{ post.resumen_de_ia }}",https://www.biobiochile.cl/noticias/nacional/region-del-bio-bio/2024/08/25/adolescente-acusado-de-homicidio-incumple-arresto-domiciliario-en-lota-y-termina-con-la-misma-medida.shtml,Adolescente acusado de homicidio incumple arresto domiciliario en Lota y termina con la misma medida,53.876.807,ciencia
"El joven campeón mundial de cartas Pokémon, Fernando Cifuentes, reveló en una reciente entrevista su historia familiar ligada al juego que se ha convertido en toda una tradición para él. A sus 17 años, el iquiqueño se coronó como el nuevo campeón en Hawaii, recibiendo felicitaciones de fanáticos y compañeros de colegio que hicieron filas para obtener su firma en su carta favorita. Además, se hizo acreedor de una millonaria suma de 50 mil dólares, un trofeo y una carta especial que lo consagran como campeón del mundo. En la entrevista Fernando destacó la importancia y el valor educativo del juego, mencionando cómo las cartas Pokémon van más allá de ser simplemente un pasatiempo al desarrollar habilidades como el pensamiento estratégico, las matemáticas y la comprensión lectora. En una reciente entrevista, el campeón mundial de cartas Pokémon, Fernando Cifuentes, contó la particular historia familiar que lo liga hace años con el juego. Hace exactamente una semana, el iquiqueño de 17 años se transformó en el nuevo campeón mundial de la disciplina de cartas Pokémon en Hawaii. El torneo, se trató de un duelo entre dos personas con las cartas coleccionables basado en la franquicia Pokémon, la que incluye tanto series animadas como videojuegos. Tras su triunfo, el iquiqueño fue felicitado por fanáticos tanto de Chile, como de Latinoamérica, pero también de sus compañeros de colegio, quienes realizaron filas para obtener su firma. Sumado a ello, ganó una millonaria cifra de 50 mil dólares; 45 millones de pesos; un trofeo y una carta especial que lo consagran como campeón del mundo. En una entrevista para “La Arenga del Abuelo”, el joven contó como nació el fanatismo por el juego de cartas, lo cual sería toda una tradición familiar. Fernando contó que su padre y su hermano jugaban antes de que él supiera de que se trataban las famosas cartas. De hecho, ambos también participaron del certamen en Hawaii. “Mi papá y mi hermano jugaban cartas Pokemón desde mucho antes que yo supiera lo que era una carta. Yo a los 7 años comencé a jugar y ahí empecé a competir”, relata. “Crecí jugando torneos en Iquique y de a poco nos fuimos volviendo más buenos. Con mi papá y mi hermano ganábamos torneos y empezábamos a viajar a distintos lugares“, agrega. “Tuvimos muy buenos resultados este año y nos permitió clasificar a los tres al mundial. Entrenábamos y nos potenciábamos. Yo tengo 17 años, mi hermano 23 y mi papá 54”, cuenta. En cuanto a su sentir luego de ganar a chilenos, polacos, estadounidenses, australianos y finalmente a su rival Japonés en la competencia, Fernando relata sentir una sensación increíble. “Cuando gané no sabía qué hacer, miraba para todos lados. Me salió todo lo que preparé y estudié, también tuve suerte y supe aprovechar los momentos. Fue increíble”, expresó. Congratulations to Fernando Cifuentes for becoming your #PokemonTCG Masters Division World Champion! #PokemonWorlds pic.twitter.com/4mXgnNlsG7 — Pokémon TCG (@PokemonTCG) August 19, 2024  Finalmente reflexionó respecto a su pasatiempo con las cartas Pokémon, y como para él, no es un simple juego. “Tengo dos cosas par decir: la primera es que las cartas Pokémon nunca se dejaron de jugar y la segunda es que este tipo de va más allá del simple juego de cartas… Desarrolla el pensamiento, la mente, las matemáticas, el inglés, la estrategia y la comprensión lectora“, reflexionó. {{ post.resumen_de_ia }}",https://www.biobiochile.cl/noticias/sociedad/historia/2024/08/26/campeon-mundial-de-cartas-pokemon-relata-origen-de-su-pasion-mi-papa-y-hermano-jugaban.shtml,"Campeón mundial de cartas Pokémon relata origen de su pasión: ""Mi papá y hermano jugaban""",53.558.904,deportes
" El parlamentario exigió que ""de una vez por todas se ocupen de las cosas"", luego de que un grupo de encapuchados prendiera con acelerantes un vagón del tren que pasaba por un cruce ferroviario. ""Es tremendamente preocupante, es un acto criminal, ¿Por qué las autoridades permiten que haya este tipo de situaciones? Estos terroristas tenían en sus manos un lienzo que pedía el traslado de Héctor Llaitul a la cárcel de Temuco, para reunirse con las hordas terroristas que se encuentran en esa cárcel, y así poder planificar sus atentados"", dijo el diputado Miguel Mellado, luego de los hechos ocurridos anoche en el cruce Barnet, en plena ciudad de Padre Las Casas y a metros de la salida sur de Temuco. ""¿Dónde están las fuerzas de orden y de seguridad? En plena ciudad, para que tomen detenidos de una vez por todas a estos tipos que hacen daño y que intentan quemar un tren de pasajeros"", se cuestionó además el diputado Mellado. ""Le pido a las autoridades que de una vez por todas se ocupen de las cosas, ellos no están ahí de bonito, sino por política y tienen que tener la fuerza suficiente para proteger a los ciudadanos. Deben proteger los sectores que eventualmente puedan ser usados por estos delincuentes, están para resguardar a la población, para eso se les paga”, exigió finalmente el parlamentario. La máxima autoridad del Ministerio Público en La Araucanía solicitó recursos al gobernador regional Luciano Rivas en 2022, sin registrar la reunión por ley del Lobby. El subsecretario Vergara destacó el trabajo realizado por la Policía de Investigaciones y valoró la puesta en marcha de nueva tecnología preventiva en la comuna. Carabineros realizó un cierre perimetral de la capital regional registrando vehículos y controlando a quienes salen de la ciudad. Aquí video en vivo desde el hospital. Se identificaron propiedades que funcionaban como talleres sin contar con patente municipal. Edgardo Villagrán Leal contrató a varias personas para dar una golpiza al presunto responsable de un fraude. Al día siguiente secuestró al hermano de la víctima. El diputado Miguel Mellado solicitó el 12 de marzo pasado que se implementara la medida que ayuda a personas en situación de calle a pasar el invierno. La alerta de AraucaniaDiario obligó a las autoridades del plantel a transparentar lo que estaba sucediendo. En 2025 el CFT no se cerrará. La empresa de energía debe mantener las antenas del cerro Ñielol funcionando y gasta al día $800 mil en un generador, pero no llegaron a un acuerdo en el valor a cancelar por soterrar sus cables, dinero que irá en directo beneficio de la comunidad. Según declaración de un ex funcionario PDI que investigó el crimen, Paredes hizo omitir evidencia que vinculaba al esposo de una profesora del Colegio Bautista. Desde la comunidad Juan Canuleo Pinoleo reclaman tener aplicabilidad desde hace 24 años y que le compraron el predio a familias de Galvarino. La mujer habría abusado de la menor de 14 años en el colegio y en su residencia particular, enviando inclusive cartas y audios a su alumna.  Sociedad Periodística Araucanía Diario Limitada 76.984.613-1 Nuestra Misión Informar a la región, Chile y el Mundo sobre lo que sucede en La Araucanía, con noticias veraces, oportunas y completas, con un afán regionalista, ciudadano y pluralista. Nuestra Visión Ser el medio de comunicación más importante de la región de La Araucanía, donde tanto medios nacionales como internacionales buscan información o la corroboran, así como lo hace la ciudadanía de la región y el país.  ",https://araucaniadiario.cl/contenido/25591/diputado-mellado-cuestiona-al-gobierno-por-atentado-a-tren-con-pasajeros-en-padr,Diputado Mellado cuestiona al Gobierno por atentado a tren con pasajeros en Padre Las Casas,53.654.556,tecnologia
"De acuerdo con los datos del organismo electoral, participaron en la elección unos 12 millones de personas. Según señalaron, el líder del régimen obtuvo 51,95% de los votos, mientras que el opositor Edmundo González alcanzó el 43,18%. (CNN en Español) – El Consejo Nacional Electoral (CNE) dio a conocer este viernes el segundo boletín con los resultados de las elecciones presidenciales del domingo, cinco días después de finalizado el proceso. Con el 96,87% de las actas transmitidas, el candidato a la reelección, Nicolás Maduro, obtuvo 51,95% de los votos mientras que el candidato de la opositora Plataforma de la Unidad Democrática, Edmundo González Urrutia, alcanzó el 43,18%, informó el presidente del organismo, Elvis Amoroso. De acuerdo con esos resultados, la ventaja de Maduro se amplió respecto a lo anunciado en el primer boletín de la madrugada del lunes. Según los datos ofrecidos por el órgano electoral, participó el 59,97% del padrón electoral, lo que equivale a unos 12 millones de personas. Amoroso, quien no presentó actas ni aceptó preguntas de la prensa, dijo que ataques informáticos procedentes de varios países retrasaron la transmisión de resultados. El domingo, el presidente del CNE había dicho que los ataques provenían de direcciones IP ubicadas en Macedonia del Norte, pero el Gobierno de ese país respondió el martes que no había recibido informes de esa versión de sus homólogos venezolanos. En una entrevista con CNN Chile, el politólogo estadounidense afirmó que Venezuela está experimentando el ""fraude más gigantesco en la historia moderna"".",https://www.cnnchile.com/mundo/cinco-dias-despues-elecciones-sin-actas-cne-boletin-amplia-ventaja-nicolas-maduro_20240802/,Cinco días después de la elección y sin desglose de actas: CNE publica segundo boletín que amplía la ventaja de Maduro,53.426.095,internacional
